{
  "ARRANGEMENT": "LINEAR_ARRANGEMENT",
  "ASSEMBLY_CIRCULATION": [
    {
      "ACTIVE_STATES": [
        "NORMAL_PRODUCTION",
        "SHIFT_CHANGE",
        "CLEANING",
        "MAINTENANCE"
      ],
      "APPROVAL_STATUS": "NOT_PROJECT_APPROVED",
      "COMPONENT_ID": "LINK_B_0",
      "COMPONENT_TYPE": "CIRCULATION_ENVELOPE",
      "COORDINATE_SYSTEM": "ASSEMBLY_GLOBAL",
      "DIMENSION_UNIT": "mm",
      "GEOMETRY": {
        "BOUNDS_MM": [
          2250,
          650,
          7950,
          950
        ],
        "TYPE": "RECTANGLE"
      },
      "OVERLAP_POLICY": "EXPLICIT_SHARED_REVIEW",
      "ROLE": "SHARED_AISLE",
      "SIMULTANEITY": "ALL_ACTIVE_COMPONENTS_IN_STATE",
      "SOURCE_ID": "synthetic",
      "SOURCE_VERIFICATION": "CONTENT_REQUIRED",
      "TRANSFORM": {
        "ROTATION_DEG": 0,
        "TRANSLATION_MM": [
          0,
          0
        ]
      }
    }
  ],
  "ASSEMBLY_ROUTES": [
    {
      "ACTIVE_STATES": [
        "NORMAL_PRODUCTION",
        "SHIFT_CHANGE",
        "CLEANING",
        "MAINTENANCE"
      ],
      "FLOW_KIND": "PERSONNEL",
      "FROM_KEY": "A/ENTRY",
      "POINTS_MM": [
        [
          2400,
          800
        ],
        [
          7800,
          800
        ]
      ],
      "ROUTE_ID": "LINK_B",
      "SOURCE_ID": "synthetic",
      "TO_KEY": "B/ENTRY",
      "WIDTH_MM": 300
    }
  ],
  "COMPONENTS": [
    {
      "ACTIVE_STATES": [
        "NORMAL_PRODUCTION",
        "SHIFT_CHANGE",
        "CLEANING",
        "MAINTENANCE"
      ],
      "APPROVAL_STATUS": "NOT_PROJECT_APPROVED",
      "COMPONENT_ID": "EQUIPMENT",
      "COMPONENT_TYPE": "PACKING_STATION_ENVELOPE",
      "COORDINATE_SYSTEM": "STATION_LOCAL",
      "DIMENSION_UNIT": "mm",
      "GEOMETRY": {
        "BOUNDS_MM": [
          1000,
          2200,
          3400,
          3000
        ],
        "TYPE": "RECTANGLE"
      },
      "OVERLAP_POLICY": "PHYSICAL_EXCLUSIVE",
      "ROLE": "BODY",
      "SIMULTANEITY": "ALL_ACTIVE_COMPONENTS_IN_STATE",
      "SOURCE_ID": "synthetic",
      "SOURCE_VERIFICATION": "CONTENT_REQUIRED",
      "TRANSFORM": {
        "ROTATION_DEG": 0,
        "TRANSLATION_MM": [
          0,
          0
        ]
      }
    },
    {
      "ACTIVE_STATES": [
        "NORMAL_PRODUCTION"
      ],
      "APPROVAL_STATUS": "NOT_PROJECT_APPROVED",
      "COMPONENT_ID": "SUPPLY",
      "COMPONENT_TYPE": "MATERIAL_SUPPLY_ENVELOPE",
      "COORDINATE_SYSTEM": "STATION_LOCAL",
      "DIMENSION_UNIT": "mm",
      "GEOMETRY": {
        "BOUNDS_MM": [
          200,
          2400,
          800,
          3000
        ],
        "TYPE": "RECTANGLE"
      },
      "OVERLAP_POLICY": "INTERACTION_REVIEW",
      "ROLE": "SUPPLY",
      "SIMULTANEITY": "ALL_ACTIVE_COMPONENTS_IN_STATE",
      "SOURCE_ID": "synthetic",
      "SOURCE_VERIFICATION": "CONTENT_REQUIRED",
      "TRANSFORM": {
        "ROTATION_DEG": 0,
        "TRANSLATION_MM": [
          0,
          0
        ]
      }
    },
    {
      "ACTIVE_STATES": [
        "NORMAL_PRODUCTION"
      ],
      "APPROVAL_STATUS": "NOT_PROJECT_APPROVED",
      "COMPONENT_ID": "OUTFEED",
      "COMPONENT_TYPE": "PRODUCT_OUTFEED_ENVELOPE",
      "COORDINATE_SYSTEM": "STATION_LOCAL",
      "DIMENSION_UNIT": "mm",
      "GEOMETRY": {
        "BOUNDS_MM": [
          3600,
          2400,
          4200,
          3000
        ],
        "TYPE": "RECTANGLE"
      },
      "OVERLAP_POLICY": "INTERACTION_REVIEW",
      "ROLE": "OUTFEED",
      "SIMULTANEITY": "ALL_ACTIVE_COMPONENTS_IN_STATE",
      "SOURCE_ID": "synthetic",
      "SOURCE_VERIFICATION": "CONTENT_REQUIRED",
      "TRANSFORM": {
        "ROTATION_DEG": 0,
        "TRANSLATION_MM": [
          0,
          0
        ]
      }
    },
    {
      "ACTIVE_STATES": [
        "NORMAL_PRODUCTION",
        "SHIFT_CHANGE",
        "CLEANING",
        "MAINTENANCE"
      ],
      "APPROVAL_STATUS": "NOT_PROJECT_APPROVED",
      "COMPONENT_ID": "PEOPLE_AISLE",
      "COMPONENT_TYPE": "CIRCULATION_ENVELOPE",
      "COORDINATE_SYSTEM": "STATION_LOCAL",
      "DIMENSION_UNIT": "mm",
      "GEOMETRY": {
        "BOUNDS_MM": [
          0,
          400,
          4800,
          1500
        ],
        "TYPE": "RECTANGLE"
      },
      "OVERLAP_POLICY": "INTERACTION_REVIEW",
      "ROLE": "PERSONNEL_AISLE",
      "SIMULTANEITY": "ALL_ACTIVE_COMPONENTS_IN_STATE",
      "SOURCE_ID": "synthetic",
      "SOURCE_VERIFICATION": "CONTENT_REQUIRED",
      "TRANSFORM": {
        "ROTATION_DEG": 0,
        "TRANSLATION_MM": [
          0,
          0
        ]
      }
    },
    {
      "ACTIVE_STATES": [
        "NORMAL_PRODUCTION",
        "SHIFT_CHANGE",
        "CLEANING",
        "MAINTENANCE"
      ],
      "APPROVAL_STATUS": "NOT_PROJECT_APPROVED",
      "COMPONENT_ID": "IN_AISLE",
      "COMPONENT_TYPE": "CIRCULATION_ENVELOPE",
      "COORDINATE_SYSTEM": "STATION_LOCAL",
      "DIMENSION_UNIT": "mm",
      "GEOMETRY": {
        "BOUNDS_MM": [
          0,
          1500,
          200,
          4500
        ],
        "TYPE": "RECTANGLE"
      },
      "OVERLAP_POLICY": "INTERACTION_REVIEW",
      "ROLE": "MATERIAL_AISLE",
      "SIMULTANEITY": "ALL_ACTIVE_COMPONENTS_IN_STATE",
      "SOURCE_ID": "synthetic",
      "SOURCE_VERIFICATION": "CONTENT_REQUIRED",
      "TRANSFORM": {
        "ROTATION_DEG": 0,
        "TRANSLATION_MM": [
          0,
          0
        ]
      }
    },
    {
      "ACTIVE_STATES": [
        "NORMAL_PRODUCTION",
        "SHIFT_CHANGE",
        "CLEANING",
        "MAINTENANCE"
      ],
      "APPROVAL_STATUS": "NOT_PROJECT_APPROVED",
      "COMPONENT_ID": "OUT_AISLE",
      "COMPONENT_TYPE": "CIRCULATION_ENVELOPE",
      "COORDINATE_SYSTEM": "STATION_LOCAL",
      "DIMENSION_UNIT": "mm",
      "GEOMETRY": {
        "BOUNDS_MM": [
          4200,
          1500,
          4800,
          4500
        ],
        "TYPE": "RECTANGLE"
      },
      "OVERLAP_POLICY": "INTERACTION_REVIEW",
      "ROLE": "MATERIAL_AISLE",
      "SIMULTANEITY": "ALL_ACTIVE_COMPONENTS_IN_STATE",
      "SOURCE_ID": "synthetic",
      "SOURCE_VERIFICATION": "CONTENT_REQUIRED",
      "TRANSFORM": {
        "ROTATION_DEG": 0,
        "TRANSLATION_MM": [
          0,
          0
        ]
      }
    },
    {
      "ACTIVE_STATES": [
        "NORMAL_PRODUCTION",
        "SHIFT_CHANGE",
        "CLEANING",
        "MAINTENANCE"
      ],
      "APPROVAL_STATUS": "NOT_PROJECT_APPROVED",
      "COMPONENT_ID": "REAR_AISLE",
      "COMPONENT_TYPE": "CIRCULATION_ENVELOPE",
      "COORDINATE_SYSTEM": "STATION_LOCAL",
      "DIMENSION_UNIT": "mm",
      "GEOMETRY": {
        "BOUNDS_MM": [
          0,
          3900,
          4800,
          4500
        ],
        "TYPE": "RECTANGLE"
      },
      "OVERLAP_POLICY": "INTERACTION_REVIEW",
      "ROLE": "SHARED_AISLE",
      "SIMULTANEITY": "ALL_ACTIVE_COMPONENTS_IN_STATE",
      "SOURCE_ID": "synthetic",
      "SOURCE_VERIFICATION": "CONTENT_REQUIRED",
      "TRANSFORM": {
        "ROTATION_DEG": 0,
        "TRANSLATION_MM": [
          0,
          0
        ]
      }
    },
    {
      "ACTIVE_STATES": [
        "CLEANING",
        "MAINTENANCE"
      ],
      "APPROVAL_STATUS": "NOT_PROJECT_APPROVED",
      "COMPONENT_ID": "SERVICE",
      "COMPONENT_TYPE": "CLEANING_MAINTENANCE_ENVELOPE",
      "COORDINATE_SYSTEM": "STATION_LOCAL",
      "DIMENSION_UNIT": "mm",
      "GEOMETRY": {
        "BOUNDS_MM": [
          800,
          3100,
          3600,
          3900
        ],
        "TYPE": "RECTANGLE"
      },
      "OVERLAP_POLICY": "INTERACTION_REVIEW",
      "ROLE": "SERVICE",
      "SIMULTANEITY": "ALL_ACTIVE_COMPONENTS_IN_STATE",
      "SOURCE_ID": "synthetic",
      "SOURCE_VERIFICATION": "CONTENT_REQUIRED",
      "TRANSFORM": {
        "ROTATION_DEG": 0,
        "TRANSLATION_MM": [
          0,
          0
        ]
      }
    },
    {
      "ACTIVE_STATES": [
        "NORMAL_PRODUCTION"
      ],
      "APPROVAL_STATUS": "NOT_PROJECT_APPROVED",
      "COMPONENT_ID": "STAND_1",
      "COMPONENT_TYPE": "OPERATOR_ENVELOPE",
      "COORDINATE_SYSTEM": "STATION_LOCAL",
      "DIMENSION_UNIT": "mm",
      "GEOMETRY": {
        "BOUNDS_MM": [
          1100,
          1500,
          1700,
          2100
        ],
        "TYPE": "RECTANGLE"
      },
      "OVERLAP_POLICY": "PHYSICAL_EXCLUSIVE",
      "ROLE": "STANDING",
      "SIMULTANEITY": "ALL_ACTIVE_COMPONENTS_IN_STATE",
      "SOURCE_ID": "synthetic",
      "SOURCE_VERIFICATION": "CONTENT_REQUIRED",
      "TRANSFORM": {
        "ROTATION_DEG": 0,
        "TRANSLATION_MM": [
          0,
          0
        ]
      }
    },
    {
      "ACTIVE_STATES": [
        "NORMAL_PRODUCTION"
      ],
      "APPROVAL_STATUS": "NOT_PROJECT_APPROVED",
      "COMPONENT_ID": "REACH_1",
      "COMPONENT_TYPE": "OPERATOR_ENVELOPE",
      "COORDINATE_SYSTEM": "STATION_LOCAL",
      "DIMENSION_UNIT": "mm",
      "GEOMETRY": {
        "BOUNDS_MM": [
          1100,
          1900,
          1700,
          2500
        ],
        "TYPE": "RECTANGLE"
      },
      "OVERLAP_POLICY": "INTERACTION_REVIEW",
      "ROLE": "REACH",
      "SIMULTANEITY": "ALL_ACTIVE_COMPONENTS_IN_STATE",
      "SOURCE_ID": "synthetic",
      "SOURCE_VERIFICATION": "CONTENT_REQUIRED",
      "TRANSFORM": {
        "ROTATION_DEG": 0,
        "TRANSLATION_MM": [
          0,
          0
        ]
      }
    },
    {
      "ACTIVE_STATES": [
        "NORMAL_PRODUCTION"
      ],
      "APPROVAL_STATUS": "NOT_PROJECT_APPROVED",
      "COMPONENT_ID": "STAND_2",
      "COMPONENT_TYPE": "OPERATOR_ENVELOPE",
      "COORDINATE_SYSTEM": "STATION_LOCAL",
      "DIMENSION_UNIT": "mm",
      "GEOMETRY": {
        "BOUNDS_MM": [
          1800,
          1500,
          2400,
          2100
        ],
        "TYPE": "RECTANGLE"
      },
      "OVERLAP_POLICY": "PHYSICAL_EXCLUSIVE",
      "ROLE": "STANDING",
      "SIMULTANEITY": "ALL_ACTIVE_COMPONENTS_IN_STATE",
      "SOURCE_ID": "synthetic",